{
  "feature": "DEV-37-03-not-found-dark",
  "linear_issue": "DEV-37",
  "spec": "specs/DEV-37-03-not-found-dark.md",
  "created": "2026-07-12",
  "status": "reviewing",
  "tasks": [
    {
      "id": "NF-1",
      "title": "Place ThemeToggle in the 404 header and verify dark contrast",
      "scope": ["src/NotFoundPage.jsx", "src/NotFoundPage.test.jsx"],
      "depends_on": [],
      "acceptance_criteria": [
        "ThemeToggle is imported and rendered in the 404 page header, right-aligned (header already uses justify-content: space-between).",
        "The page still reads its colors from HF.* (var(--c-*)) so it renders dark automatically under data-theme=\"dark\"; no hard-coded colors are introduced.",
        "Header layout stays intact; the toggle sits opposite the title.",
        "Light mode rendering is unchanged."
      ],
      "tests": [
        "NotFoundPage renders a theme toggle button in its header",
        "NotFoundPage still renders the 404 heading and the back button"
      ]
    }
  ],
  "out_of_scope": [
    "Admin (04), login (05).",
    "Any token changes (delivered in 02)."
  ],
  "open_questions": []
}
